{
  "schema": "https://starriverarts.github.io/StarRiver-Arts-Site/site-index.schema.json",
  "generated_at": "2026-10-27T00:30:41+08:00",
  "site": {
    "name": "StarRiver Arts",
    "zh_name": "星河 StarRiver Arts",
    "description": "StarRiver Arts is a bilingual portfolio and project site for VR application design, landscape and terrain modeling, ProjectT Taiwan landscape experiences, VR Racing Club Time Attack, and digital curation.",
    "languages": [
      "zh-TW",
      "en"
    ],
    "creator": "StarRiver / 星河",
    "base_url": "https://starriverarts.github.io/StarRiver-Arts-Site/"
  },
  "key_topics": [
    "StarRiver Arts",
    "星河",
    "VRChat world design",
    "VR environment design",
    "Taiwan landscape modeling",
    "ProjectT",
    "VR Racing Club",
    "Time Attack leaderboard",
    "digital curation",
    "web exhibition"
  ],
  "data_endpoints": [
    {
      "path": "play/RacingClub/TimeAttack/data/summary.json",
      "url": "https://starriverarts.github.io/StarRiver-Arts-Site/play/RacingClub/TimeAttack/data/summary.json"
    },
    {
      "path": "play/RacingClub/TimeAttack/data/manifest.json",
      "url": "https://starriverarts.github.io/StarRiver-Arts-Site/play/RacingClub/TimeAttack/data/manifest.json"
    },
    {
      "path": "play/RacingClub/TimeAttack/data/tracks.json",
      "url": "https://starriverarts.github.io/StarRiver-Arts-Site/play/RacingClub/TimeAttack/data/tracks.json"
    },
    {
      "path": "play/RacingClub/TimeAttack/data/vehicles.json",
      "url": "https://starriverarts.github.io/StarRiver-Arts-Site/play/RacingClub/TimeAttack/data/vehicles.json"
    },
    {
      "path": "play/RacingClub/TimeAttack/data/players.json",
      "url": "https://starriverarts.github.io/StarRiver-Arts-Site/play/RacingClub/TimeAttack/data/players.json"
    },
    {
      "path": "play/RacingClub/TimeAttack/data/teams.json",
      "url": "https://starriverarts.github.io/StarRiver-Arts-Site/play/RacingClub/TimeAttack/data/teams.json"
    },
    {
      "path": "play/RacingClub/TimeAttack/data/events.json",
      "url": "https://starriverarts.github.io/StarRiver-Arts-Site/play/RacingClub/TimeAttack/data/events.json"
    },
    {
      "path": "play/RacingClub/TimeAttack/data/event-editorial.json",
      "url": "https://starriverarts.github.io/StarRiver-Arts-Site/play/RacingClub/TimeAttack/data/event-editorial.json"
    },
    {
      "path": "play/RacingClub/TimeAttack/data/catalog.json",
      "url": "https://starriverarts.github.io/StarRiver-Arts-Site/play/RacingClub/TimeAttack/data/catalog.json"
    },
    {
      "path": "play/RacingClub/TimeAttack/data/trackmap.json",
      "url": "https://starriverarts.github.io/StarRiver-Arts-Site/play/RacingClub/TimeAttack/data/trackmap.json"
    },
    {
      "path": "play/RacingClub/TimeAttack/data/proofs.json",
      "url": "https://starriverarts.github.io/StarRiver-Arts-Site/play/RacingClub/TimeAttack/data/proofs.json"
    },
    {
      "path": "play/RacingClub/TimeAttack/vrc/index.json",
      "url": "https://starriverarts.github.io/StarRiver-Arts-Site/play/RacingClub/TimeAttack/vrc/index.json"
    },
    {
      "path": "play/RacingClub/TimeAttack/vrc/players.json",
      "url": "https://starriverarts.github.io/StarRiver-Arts-Site/play/RacingClub/TimeAttack/vrc/players.json"
    },
    {
      "path": "play/RacingClub/TimeAttack/vrc/teams.json",
      "url": "https://starriverarts.github.io/StarRiver-Arts-Site/play/RacingClub/TimeAttack/vrc/teams.json"
    },
    {
      "path": "play/RacingClub/TimeAttack/vrc/vehicles.json",
      "url": "https://starriverarts.github.io/StarRiver-Arts-Site/play/RacingClub/TimeAttack/vrc/vehicles.json"
    }
  ],
  "pages": [
    {
      "id": "index",
      "path": "index.html",
      "url": "https://starriverarts.github.io/StarRiver-Arts-Site/",
      "title": "StarRiver Arts | VR 數位體驗的地景創作者",
      "description": "StarRiver Arts 以 VR 應用設計、景觀地景建模與數位策展規劃，連結 Studio、ProjectT 與 Museum 季前展。",
      "section": "home",
      "section_label": "StarRiver Arts",
      "languages": [
        "zh-TW",
        "en"
      ],
      "tags": [
        "StarRiver Arts",
        "home",
        "星河",
        "Studio",
        "ProjectT",
        "Museum",
        "VRChat",
        "Taiwan",
        "mountain road",
        "racing",
        "exhibition"
      ],
      "headings": [
        "StarRiver Arts",
        "Studio",
        "ProjectT",
        "Museum"
      ],
      "lastmod": "2026-10-27",
      "priority": 1.0,
      "search_text": "跳到主要內容 Skip to content 星河 STARRIVER ARTS 星河 · STARRIVER ARTS StarRiver Arts VR 數位體驗的地景創作者 A landscape creator for VR digital experiences 向下探索 Explore below 01 · STUDIO Studio 作品集與專業能力 Portfolio & Capabilities 精選 VR 應用、景觀地景建模與數位策展作品。 Selected work in VR applications, landscape modeling, and digital curation. 進入 Studio Enter Studio 02 · PROJECTT ProjectT 臺灣山道計畫 · VRChat 賽車社群 Taiwan Touge Project 以臺灣為起點，連結 VRChat 世界、賽車社群、紀錄與賽事工具。 VRChat worlds, a racing community, records, and competition tools grounded in Taiwan. 進入 ProjectT Enter ProjectT 03 · MUSEUM Museum 數位展覽與文化探索 Digital exhibitions & culture 從現有網頁展覽出發，探索數位創作、觀看方式與文化內容。 Explore web exhibitions and a growing space for creative and cultural work. 進入 Museum Enter Museum CONNECT · SOCIAL HUB 在其他地方找到 StarRiver Find StarRiver elsewhere 社群平台、VRChat 與主要社群入口。 Social platforms, VRChat, and community links. 開啟 Social Hub Open Social Hub 網站由 StarRiver Arts 主導規劃與製作，並使用 OpenAI GPT 與 Anthropic Claude 協助資訊架構與網頁開發。 Planned and produced by StarRiver Arts, with OpenAI GPT and Anthropic Claude used to assist information architecture and web development."
    },
    {
      "id": "museum-about",
      "path": "museum/about.html",
      "url": "https://starriverarts.github.io/StarRiver-Arts-Site/museum/about.html",
      "title": "關於 | StarRiver Museum",
      "description": "StarRiver Museum 關於頁，說明美術館如何把 VR、網頁與空間敘事視為展覽媒介。",
      "section": "museum",
      "section_label": "Museum",
      "languages": [
        "zh-TW",
        "en"
      ],
      "tags": [
        "Museum",
        "VR museum",
        "exhibition",
        "gallery",
        "museum about",
        "VR exhibition",
        "spatial narrative",
        "VRChat"
      ],
      "headings": [],
      "lastmod": "2026-10-27",
      "priority": 0.9,
      "search_text": "跳到主要內容 Skip to content StarRiver Arts Museum 首頁 Home 展覽 Exhibitions 關於 About 聯絡 Contact EN 中 About 關於 Museum About Museum StarRiver Museum 是一項持續發展中的數位策展與創作計畫。 StarRiver Museum is an evolving digital curation and creative project. 我們希望用展覽、文字、互動體驗與虛擬空間，組織不同形式的作品、觀察與故事。研究只是其中一種方法；作品與文化內容不需要全部以研究的形式發表。 Through exhibitions, writing, interactive experiences, and virtual spaces, Museum brings together works, observations, and stories. Research is one approach among many, not a requirement for all content. 觀看公開展示 Explore available displays 目前階段 Current stage 網站可參觀；虛擬館舍持續規劃 Public web displays; venue in development 目前已有可進入的網頁展示。獨立 VR 館舍仍在規劃，並未以完整開館的狀態對外宣告。 Browser-accessible displays are available now. A separate VR venue remains in development and is not presented as fully open. 網站與館舍 Site and venue 入口不等於建築 The site is not the building Museum 網站是策展與內容入口；虛擬館舍是其中一種空間體驗。展覽可以在網頁、獨立小站、VRChat 世界或其他媒介發生，不必先進入同一棟建築。 The Museum website is a curatorial entry point; the virtual venue is one possible spatial experience. Exhibitions may live on the web, in standalone sites, in VRChat worlds, or in other media. 呈現方式 What belongs here 作品、內容與空間 Works, writing, and spaces 除了作品展示，這裡也可以容納文化文章、社群記錄、創作筆記、研究與互動體驗。不同內容會依實際發表情形逐步建立入口，不預先假設固定展期或作品數量。 Alongside artworks, Museum can host cultural writing, community accounts, creative notes, research, and interactive experiences. Pages will follow actual published content rather than a pre-set schedule or quota. 聯絡與合作詢問 Contact & collaboration © 2026 StarRiver Arts StarRiver Museum"
    },
    {
      "id": "museum-contact",
      "path": "museum/contact.html",
      "url": "https://starriverarts.github.io/StarRiver-Arts-Site/museum/contact.html",
      "title": "Contact | StarRiver Museum",
      "description": "StarRiver Museum 聯絡頁，供合作邀請、展覽提案、支持洽談或一般詢問使用。",
      "section": "museum",
      "section_label": "Museum",
      "languages": [
        "zh-TW",
        "en"
      ],
      "tags": [
        "Museum",
        "VR museum",
        "exhibition",
        "gallery",
        "contact",
        "collaboration",
        "proposal"
      ],
      "headings": [],
      "lastmod": "2026-10-27",
      "priority": 0.9,
      "search_text": "跳到主要內容 Skip to content StarRiver Arts Museum 首頁 Home 展覽 Exhibitions 關於 About 聯絡 Contact EN 中 Contact 聯絡 Contact 展覽提案、策展合作、技術協作與一般詢問，都可以由 email 開始。 Exhibition proposals, curatorial collaboration, technical cooperation, and general enquiries can all begin by email. StarRiverAnythings@gmail.com 來信建議 Email Guidance 請在主旨標明聯絡目的 State the purpose in the subject line 合作邀請 Collaboration 展覽提案 Exhibition Proposal 技術協作 Technical Collaboration © 2026 StarRiver Arts StarRiver Museum"
    },
    {
      "id": "museum-exhibitions",
      "path": "museum/exhibitions.html",
      "url": "https://starriverarts.github.io/StarRiver-Arts-Site/museum/exhibitions.html",
      "title": "展覽與體驗 | StarRiver Museum",
      "description": "StarRiver Museum 展覽資訊頁，整理正式展覽狀態、展覽形式與參觀入口。",
      "section": "museum",
      "section_label": "Museum",
      "languages": [
        "zh-TW",
        "en"
      ],
      "tags": [
        "Museum",
        "VR museum",
        "exhibition",
        "gallery",
        "exhibitions",
        "web exhibition"
      ],
      "headings": [],
      "lastmod": "2026-10-27",
      "priority": 0.9,